{
  "brand": "hunyuan",
  "recipe_version": "tofu.provider-offering-recipe/v1",
  "key": "tencent",
  "category": "official",
  "name": "Tencent TokenHub",
  "base_url": "https://tokenhub.tencentmaas.com/v1",
  "balance_url": "",
  "offering_recipes": [
    {
      "model_id": "hy4-preview",
      "capabilities": [
        "text",
        "thinking",
        "cheap"
      ],
      "rpm": 30,
      "cost": 0.003,
      "pricing": {
        "input": 0.829,
        "output": 2.486,
        "cacheWriteMul": 1.0,
        "cacheReadMul": 0.05,
        "name": "Hunyuan HY4 Preview (TokenHub)"
      }
    },
    {
      "model_id": "hy3-preview",
      "capabilities": [
        "text",
        "thinking",
        "cheap"
      ],
      "rpm": 30,
      "cost": 0.001,
      "pricing": {
        "input": 0.166,
        "output": 0.553,
        "cacheWriteMul": 1.0,
        "cacheReadMul": 0.333,
        "name": "Hunyuan HY3 Preview (TokenHub)"
      }
    },
    {
      "model_id": "hunyuan-2.0-thinking-20251109",
      "capabilities": [
        "text",
        "thinking",
        "cheap"
      ],
      "rpm": 30,
      "cost": 0.003,
      "pricing": {
        "input": 0.549,
        "output": 2.196,
        "cacheWriteMul": 1.0,
        "cacheReadMul": 0.1,
        "name": "Hunyuan 2.0 Thinking (TokenHub)"
      }
    },
    {
      "model_id": "hunyuan-2.0-instruct-20251111",
      "capabilities": [
        "text",
        "cheap"
      ],
      "rpm": 30,
      "cost": 0.002,
      "pricing": {
        "input": 0.439,
        "output": 1.098,
        "cacheWriteMul": 1.0,
        "cacheReadMul": 0.1,
        "name": "Hunyuan 2.0 Instruct (TokenHub)"
      }
    },
    {
      "model_id": "hunyuan-role-latest",
      "capabilities": [
        "text",
        "cheap"
      ],
      "rpm": 30,
      "cost": 0.002,
      "pricing": {
        "input": 0.331,
        "output": 1.326,
        "cacheWriteMul": 1.0,
        "cacheReadMul": 0.1,
        "name": "Hunyuan Role (TokenHub)"
      }
    },
    {
      "model_id": "deepseek-v4-flash",
      "capabilities": [
        "text",
        "thinking",
        "cheap"
      ],
      "rpm": 60,
      "cost": 0.0002,
      "pricing": {
        "input": 0.138,
        "output": 0.276,
        "cacheWriteMul": 1.0,
        "cacheReadMul": 0.2,
        "name": "DeepSeek V4 Flash (TokenHub)"
      }
    },
    {
      "model_id": "deepseek-v4-pro",
      "capabilities": [
        "text",
        "thinking",
        "cheap"
      ],
      "rpm": 30,
      "cost": 0.003,
      "pricing": {
        "input": 1.657,
        "output": 3.315,
        "cacheWriteMul": 1.0,
        "cacheReadMul": 0.083,
        "name": "DeepSeek V4 Pro (TokenHub)"
      }
    },
    {
      "model_id": "deepseek-v3.2",
      "capabilities": [
        "text",
        "cheap"
      ],
      "rpm": 60,
      "cost": 0.0006,
      "pricing": {
        "input": 0.276,
        "output": 0.414,
        "cacheWriteMul": 1.0,
        "cacheReadMul": 0.1,
        "name": "DeepSeek V3.2 (TokenHub)"
      }
    },
    {
      "model_id": "deepseek-v3.1-terminus",
      "capabilities": [
        "text",
        "cheap"
      ],
      "rpm": 60,
      "cost": 0.001,
      "pricing": {
        "input": 0.552,
        "output": 1.657,
        "cacheWriteMul": 1.0,
        "cacheReadMul": 0.1,
        "name": "DeepSeek V3.1 Terminus (TokenHub)"
      }
    },
    {
      "model_id": "deepseek-r1-0528",
      "capabilities": [
        "text",
        "thinking",
        "cheap"
      ],
      "rpm": 30,
      "cost": 0.002,
      "pricing": {
        "input": 0.552,
        "output": 2.21,
        "cacheWriteMul": 1.0,
        "cacheReadMul": 0.1,
        "name": "DeepSeek R1 0528 (TokenHub)"
      }
    },
    {
      "model_id": "deepseek-v3-0324",
      "capabilities": [
        "text",
        "cheap"
      ],
      "rpm": 60,
      "cost": 0.001,
      "pricing": {
        "input": 0.276,
        "output": 1.105,
        "cacheWriteMul": 1.0,
        "cacheReadMul": 0.1,
        "name": "DeepSeek V3 0324 (TokenHub)"
      }
    },
    {
      "model_id": "glm-5.1",
      "capabilities": [
        "text",
        "thinking",
        "cheap"
      ],
      "rpm": 60,
      "cost": 0.003,
      "pricing": {
        "input": 0.829,
        "output": 3.315,
        "cacheWriteMul": 1.0,
        "cacheReadMul": 0.217,
        "name": "GLM-5.1 (TokenHub)"
      }
    },
    {
      "model_id": "glm-5",
      "capabilities": [
        "text",
        "thinking",
        "cheap"
      ],
      "rpm": 60,
      "cost": 0.002,
      "pricing": {
        "input": 0.552,
        "output": 2.486,
        "cacheWriteMul": 1.0,
        "cacheReadMul": 0.25,
        "name": "GLM-5 (TokenHub)"
      }
    },
    {
      "model_id": "glm-5-turbo",
      "capabilities": [
        "text",
        "cheap"
      ],
      "rpm": 60,
      "cost": 0.002,
      "pricing": {
        "input": 0.691,
        "output": 3.039,
        "cacheWriteMul": 1.0,
        "cacheReadMul": 0.24,
        "name": "GLM-5 Turbo (TokenHub)"
      }
    },
    {
      "model_id": "glm-5v-turbo",
      "capabilities": [
        "text",
        "vision",
        "cheap"
      ],
      "rpm": 60,
      "cost": 0.002,
      "pricing": {
        "input": 0.691,
        "output": 3.039,
        "cacheWriteMul": 1.0,
        "cacheReadMul": 0.24,
        "name": "GLM-5V Turbo (TokenHub)"
      }
    },
    {
      "model_id": "kimi-k3",
      "capabilities": [
        "text",
        "vision",
        "video",
        "thinking",
        "cheap"
      ],
      "rpm": 30,
      "cost": 0.0083,
      "pricing": {
        "input": 2.762,
        "output": 13.812,
        "cacheWriteMul": 1.0,
        "cacheReadMul": 0.1,
        "name": "Kimi K3 (TokenHub)"
      }
    },
    {
      "model_id": "kimi-k2.6",
      "capabilities": [
        "text",
        "cheap"
      ],
      "rpm": 30,
      "cost": 0.003,
      "pricing": {
        "input": 0.898,
        "output": 3.729,
        "cacheWriteMul": 1.0,
        "cacheReadMul": 0.169,
        "name": "Kimi K2.6 (TokenHub)"
      }
    },
    {
      "model_id": "minimax-m2.7",
      "capabilities": [
        "text",
        "cheap"
      ],
      "rpm": 60,
      "cost": 0.001,
      "pricing": {
        "input": 0.29,
        "output": 1.16,
        "cacheWriteMul": 1.0,
        "cacheReadMul": 0.2,
        "name": "MiniMax M2.7 (TokenHub)"
      }
    },
    {
      "model_id": "minimax-m2.5",
      "capabilities": [
        "text",
        "cheap"
      ],
      "rpm": 60,
      "cost": 0.001,
      "pricing": {
        "input": 0.29,
        "output": 1.16,
        "cacheWriteMul": 1.0,
        "cacheReadMul": 0.1,
        "name": "MiniMax M2.5 (TokenHub)"
      }
    },
    {
      "model_id": "hunyuan-a13b-instruct",
      "capabilities": [
        "text",
        "thinking",
        "cheap"
      ],
      "rpm": 30,
      "context_window": 131072,
      "pricing": {
        "input": 0.14,
        "output": 0.57,
        "currency": "USD",
        "unit": "per_million_tokens"
      }
    },
    {
      "model_id": "hy-mt2-1.8b",
      "capabilities": [
        "text",
        "cheap"
      ],
      "rpm": 30,
      "context_window": 8192,
      "pricing": {
        "input": 0.044,
        "output": 0.177,
        "currency": "USD",
        "unit": "per_million_tokens"
      }
    },
    {
      "model_id": "hy-mt2-30b-a3b",
      "capabilities": [
        "text",
        "cheap"
      ],
      "rpm": 30,
      "context_window": 8192,
      "pricing": {
        "input": 0.074,
        "output": 0.295,
        "currency": "USD",
        "unit": "per_million_tokens"
      }
    },
    {
      "model_id": "hy-mt2-7b",
      "capabilities": [
        "text",
        "cheap"
      ],
      "rpm": 30,
      "context_window": 8192,
      "pricing": {
        "input": 0.074,
        "output": 0.295,
        "currency": "USD",
        "unit": "per_million_tokens"
      }
    },
    {
      "model_id": "hy3",
      "capabilities": [
        "text",
        "thinking",
        "cheap"
      ],
      "rpm": 30,
      "context_window": 262144,
      "pricing": {
        "input": 0.132,
        "output": 0.528,
        "currency": "USD",
        "unit": "per_million_tokens"
      }
    }
  ]
}
