{
  "brand": "claude",
  "recipe_version": "tofu.provider-offering-recipe/v1",
  "key": "anthropic",
  "category": "official",
  "name": "Anthropic",
  "base_url": "https://api.anthropic.com/v1",
  "protocol": "anthropic",
  "offering_recipes": [
    {
      "model_id": "claude-opus-5",
      "capabilities": [
        "text",
        "vision",
        "thinking"
      ],
      "rpm": 30
    },
    {
      "model_id": "claude-sonnet-5",
      "capabilities": [
        "text",
        "vision",
        "thinking"
      ],
      "rpm": 30
    },
    {
      "model_id": "claude-fable-5-1",
      "capabilities": [
        "text",
        "vision",
        "thinking"
      ],
      "rpm": 30
    },
    {
      "model_id": "claude-fable-5",
      "capabilities": [
        "text",
        "vision",
        "thinking"
      ],
      "rpm": 30
    },
    {
      "model_id": "claude-opus-4-8",
      "capabilities": [
        "text",
        "vision",
        "thinking"
      ],
      "rpm": 30
    },
    {
      "model_id": "claude-opus-4-7",
      "capabilities": [
        "text",
        "vision",
        "thinking"
      ],
      "rpm": 30
    },
    {
      "model_id": "claude-sonnet-4-6",
      "capabilities": [
        "text",
        "vision",
        "thinking"
      ],
      "rpm": 30
    },
    {
      "model_id": "claude-haiku-4-5",
      "capabilities": [
        "text",
        "vision",
        "thinking",
        "cheap"
      ],
      "rpm": 60
    },
    {
      "model_id": "claude-3-haiku",
      "capabilities": [
        "text",
        "vision",
        "cheap"
      ],
      "rpm": 30,
      "context_window": 200000,
      "pricing": {
        "input": 0.25,
        "output": 1.25,
        "currency": "USD",
        "unit": "per_million_tokens"
      }
    },
    {
      "model_id": "claude-opus-4",
      "capabilities": [
        "text",
        "vision",
        "thinking"
      ],
      "rpm": 30,
      "context_window": 200000,
      "pricing": {
        "input": 15.0,
        "output": 75.0,
        "currency": "USD",
        "unit": "per_million_tokens"
      }
    },
    {
      "model_id": "claude-opus-4.1",
      "capabilities": [
        "text",
        "vision",
        "thinking"
      ],
      "rpm": 30,
      "context_window": 200000,
      "pricing": {
        "input": 15.0,
        "output": 75.0,
        "currency": "USD",
        "unit": "per_million_tokens"
      }
    },
    {
      "model_id": "claude-opus-4.5",
      "capabilities": [
        "text",
        "vision",
        "thinking"
      ],
      "rpm": 30,
      "context_window": 200000,
      "pricing": {
        "input": 5.0,
        "output": 25.0,
        "currency": "USD",
        "unit": "per_million_tokens"
      }
    },
    {
      "model_id": "claude-opus-4.6",
      "capabilities": [
        "text",
        "vision",
        "thinking"
      ],
      "rpm": 30,
      "context_window": 1000000,
      "pricing": {
        "input": 5.0,
        "output": 25.0,
        "currency": "USD",
        "unit": "per_million_tokens"
      }
    },
    {
      "model_id": "claude-sonnet-4",
      "capabilities": [
        "text",
        "vision",
        "thinking"
      ],
      "rpm": 30,
      "context_window": 200000,
      "pricing": {
        "input": 3.0,
        "output": 15.0,
        "currency": "USD",
        "unit": "per_million_tokens"
      }
    },
    {
      "model_id": "claude-sonnet-4.5",
      "capabilities": [
        "text",
        "vision",
        "thinking"
      ],
      "rpm": 30,
      "context_window": 200000,
      "pricing": {
        "input": 3.0,
        "output": 15.0,
        "currency": "USD",
        "unit": "per_million_tokens"
      }
    }
  ]
}
