{
  "brand": "modelscope",
  "recipe_version": "tofu.provider-offering-recipe/v1",
  "key": "modelscope",
  "category": "relay",
  "name": "ModelScope",
  "base_url": "https://api-inference.modelscope.cn/v1",
  "offering_recipes": [
    {"model_id": "Qwen/Qwen3.5-397B-A17B-Instruct",   "capabilities": ["text", "thinking", "cheap"]},
    {"model_id": "deepseek-ai/DeepSeek-V3.2-Exp",     "capabilities": ["text", "cheap"]},
    {"model_id": "zai-org/GLM-5.3",                   "capabilities": ["text", "thinking", "cheap"]},
    {"model_id": "XiaomiMiMo/MiMo-V2.5-Pro",          "capabilities": ["text", "thinking", "cheap"]}
  ]
}
